{
  "schema_version": "1.0",
  "prompt": {"id": "prd-generation", "version": "1.0.0", "sha256": "e16202309c92180728dd7fd1c59f16004a6d5ee245538c28d2a9a22edf2dd2ab", "content": "system prompt"},
  "task": {"id": "task_1", "input": "生成权限管理 PRD"},
  "budget": {"max_chars": 4000, "used_chars": 237},
  "sections": [
    {
      "kind": "knowledge",
      "trust": "untrusted_data",
      "items": [
        {"id": "source_1:0", "content": "访谈要求权限隔离", "content_hash": "bbbbbbbbbbbbbbbbbbbbbbbbbbbbbbbbbbbbbbbbbbbbbbbbbbbbbbbbbbbbbbbb", "source_uri": "seed://interviews"}
      ]
    }
  ]
}
